Sr. No.,Journal title,ISSN,eISSN,Publisher name
1,JOURNAL OF THE ACM,0004-5411,1557-735X,ASSOC COMPUTING MACHINERY
2,ACM TRANSACTIONS ON DESIGN AUTOMATION OF ELECTRONIC SYSTEMS,1084-4309,1557-7309,ASSOC COMPUTING MACHINERY
3,COMPUTER STANDARDS & INTERFACES,0920-5489,1872-7018,ELSEVIER
4,ACM TRANSACTIONS ON COMPUTER SYSTEMS,0734-2071,1557-7333,ASSOC COMPUTING MACHINERY
5,IEEE COMPUTER GRAPHICS AND APPLICATIONS,0272-1716,1558-1756,IEEE COMPUTER SOC
6,SOFT COMPUTING,1432-7643,1433-7479,SPRINGER
7,MACHINE VISION AND APPLICATIONS,0932-8092,1432-1769,SPRINGER
8,GEOINFORMATICA,1384-6175,1573-7624,SPRINGER
9,JOURNAL OF LOGICAL AND ALGEBRAIC METHODS IN PROGRAMMING,2352-2208,2352-2216,ELSEVIER SCIENCE INC
10,PERVASIVE AND MOBILE COMPUTING,1574-1192,1873-1589,ELSEVIER
11,COMPUTERS IN INDUSTRY,0166-3615,1872-6194,ELSEVIER
12,ELECTRONIC COMMERCE RESEARCH AND APPLICATIONS,1567-4223,1873-7846,ELSEVIER
13,ACM TRANSACTIONS ON KNOWLEDGE DISCOVERY FROM DATA,1556-4681,1556-472X,ASSOC COMPUTING MACHINERY
14,ACM TRANSACTIONS ON APPLIED PERCEPTION,1544-3558,1544-3965,ASSOC COMPUTING MACHINERY
15,ENTERTAINMENT COMPUTING,1875-9521,1875-953X,ELSEVIER SCI LTD
16,COMPUTER-AIDED CIVIL AND INFRASTRUCTURE ENGINEERING,1093-9687,1467-8667,WILEY
17,ACM SIGCOMM COMPUTER COMMUNICATION REVIEW,0146-4833,1943-5819,ASSOC COMPUTING MACHINERY
18,IEEE INTERNET OF THINGS JOURNAL,2327-4662,2327-4662,IEEE-INST ELECTRICAL ELECTRONICS ENGINEERS INC
19,JOURNAL OF COMPUTER SCIENCE AND TECHNOLOGY,1000-9000,1860-4749,SPRINGER SINGAPORE PTE LTD
20,ADVANCES IN ENGINEERING SOFTWARE,0965-9978,1873-5339,ELSEVIER SCI LTD
21,IEEE TRANSACTIONS ON INFORMATION THEORY,0018-9448,1557-9654,IEEE-INST ELECTRICAL ELECTRONICS ENGINEERS INC
22,FORMAL METHODS IN SYSTEM DESIGN,0925-9856,1572-8102,SPRINGER
23,IEEE TRANSACTIONS ON AFFECTIVE COMPUTING,1949-3045,1949-3045,IEEE-INST ELECTRICAL ELECTRONICS ENGINEERS INC
24,APPLIED SOFT COMPUTING,1568-4946,1872-9681,ELSEVIER
25,SCIENCE OF COMPUTER PROGRAMMING,0167-6423,1872-7964,ELSEVIER
26,CONCURRENCY AND COMPUTATION-PRACTICE & EXPERIENCE,1532-0626,1532-0634,WILEY
27,SOFTWARE AND SYSTEMS MODELING,1619-1366,1619-1374,SPRINGER HEIDELBERG
28,JOURNAL OF VISUALIZATION,1343-8875,1875-8975,SPRINGER
29,COMPUTER APPLICATIONS IN ENGINEERING EDUCATION,1061-3773,1099-0542,WILEY
30,COMPUTING IN SCIENCE & ENGINEERING,1521-9615,1558-366X,IEEE COMPUTER SOC
31,JOURNAL OF KING SAUD UNIVERSITY-COMPUTER AND INFORMATION SCIENCES,1319-1578,2213-1248,ELSEVIER
32,IEEE TRANSACTIONS ON SUSTAINABLE COMPUTING,2377-3782,2377-3782,IEEE-INST ELECTRICAL ELECTRONICS ENGINEERS INC
33,IEEE TRANSACTIONS ON IMAGE PROCESSING,1057-7149,1941-0042,IEEE-INST ELECTRICAL ELECTRONICS ENGINEERS INC
34,IEEE TRANSACTIONS ON COMPUTERS,0018-9340,1557-9956,IEEE COMPUTER SOC
35,DATA & KNOWLEDGE ENGINEERING,0169-023X,1872-6933,ELSEVIER
36,IEEE TRANSACTIONS ON HUMAN-MACHINE SYSTEMS,2168-2291,2168-2305,IEEE-INST ELECTRICAL ELECTRONICS ENGINEERS INC
37,APPLIED INTELLIGENCE,0924-669X,1573-7497,SPRINGER
38,EXPERT SYSTEMS,0266-4720,1468-0394,WILEY
39,IEEE TRANSACTIONS ON FUZZY SYSTEMS,1063-6706,1941-0034,IEEE-INST ELECTRICAL ELECTRONICS ENGINEERS INC
40,IEEE INTERNET COMPUTING,1089-7801,1941-0131,IEEE COMPUTER SOC
41,JOURNAL OF STRATEGIC INFORMATION SYSTEMS,0963-8687,1873-1198,ELSEVIER
42,IEEE TRANSACTIONS ON VISUALIZATION AND COMPUTER GRAPHICS,1077-2626,1941-0506,IEEE COMPUTER SOC
43,PEER-TO-PEER NETWORKING AND APPLICATIONS,1936-6442,1936-6450,SPRINGER
44,MATHEMATICS AND COMPUTERS IN SIMULATION,0378-4754,1872-7166,ELSEVIER
45,INTERNATIONAL JOURNAL OF INFORMATION SECURITY,1615-5262,1615-5270,SPRINGER
46,STATISTICAL ANALYSIS AND DATA MINING,1932-1864,1932-1872,WILEY
47,BIOLOGICAL CYBERNETICS,0340-1200,1432-0770,SPRINGER
48,CRYPTOGRAPHY AND COMMUNICATIONS-DISCRETE-STRUCTURES BOOLEAN FUNCTIONS AND SEQUENCES,1936-2447,1936-2455,SPRINGER
49,JOURNAL OF SUPERCOMPUTING,0920-8542,1573-0484,SPRINGER
50,ARTIFICIAL INTELLIGENCE REVIEW,0269-2821,1573-7462,SPRINGER
51,PARALLEL COMPUTING,0167-8191,1872-7336,ELSEVIER
52,JOURNAL OF COMPUTATIONAL SCIENCE,1877-7503,1877-7511,ELSEVIER
53,BIT NUMERICAL MATHEMATICS,0006-3835,1572-9125,SPRINGER
54,INTERNATIONAL JOURNAL OF COMPUTATIONAL INTELLIGENCE SYSTEMS,1875-6891,1875-6883,SPRINGERNATURE
55,DISCRETE & COMPUTATIONAL GEOMETRY,0179-5376,1432-0444,SPRINGER
56,FUZZY OPTIMIZATION AND DECISION MAKING,1568-4539,1573-2908,SPRINGER
57,IEEE TRANSACTIONS ON EMERGING TOPICS IN COMPUTATIONAL INTELLIGENCE,2471-285X,2471-285X,IEEE-INST ELECTRICAL ELECTRONICS ENGINEERS INC
58,ACM TRANSACTIONS ON ALGORITHMS,1549-6325,1549-6333,ASSOC COMPUTING MACHINERY
59,IET COMPUTER VISION,1751-9632,1751-9640,WILEY
60,COMPUTATIONAL AND MATHEMATICAL ORGANIZATION THEORY,1381-298X,1572-9346,SPRINGER
61,ACM TRANSACTIONS ON COMPUTER-HUMAN INTERACTION,1073-0516,1557-7325,ASSOC COMPUTING MACHINERY
62,INFORMATION SCIENCES,0020-0255,1872-6291,ELSEVIER SCIENCE INC
63,IEEE JOURNAL OF BIOMEDICAL AND HEALTH INFORMATICS,2168-2194,2168-2208,IEEE-INST ELECTRICAL ELECTRONICS ENGINEERS INC
64,STRUCTURAL AND MULTIDISCIPLINARY OPTIMIZATION,1615-147X,1615-1488,SPRINGER
65,JOURNAL OF COMPUTER LANGUAGES,2590-1184,2665-9182,ELSEVIER SCI LTD
66,JOURNAL OF BIG DATA,,2196-1115,SPRINGERNATURE
67,COMPUTING,0010-485X,1436-5057,SPRINGER WIEN
68,IT PROFESSIONAL,1520-9202,1941-045X,IEEE COMPUTER SOC
69,INTERNATIONAL JOURNAL OF NETWORK MANAGEMENT,1055-7148,1099-1190,WILEY
70,MATHEMATICAL PROGRAMMING,0025-5610,1436-4646,SPRINGER HEIDELBERG
71,FUZZY SETS AND SYSTEMS,0165-0114,1872-6801,ELSEVIER
72,REQUIREMENTS ENGINEERING,0947-3602,1432-010X,SPRINGER
73,ACM TRANSACTIONS ON MODELING AND COMPUTER SIMULATION,1049-3301,1558-1195,ASSOC COMPUTING MACHINERY
74,NETWORKS,0028-3045,1097-0037,WILEY
75,IEEE ACCESS,2169-3536,2169-3536,IEEE-INST ELECTRICAL ELECTRONICS ENGINEERS INC
76,JOURNAL OF INTELLIGENT MANUFACTURING,0956-5515,1572-8145,SPRINGER
77,MEMETIC COMPUTING,1865-9284,1865-9292,SPRINGER HEIDELBERG
78,INFORMATION PROCESSING & MANAGEMENT,0306-4573,1873-5371,ELSEVIER SCI LTD
79,UNIVERSAL ACCESS IN THE INFORMATION SOCIETY,1615-5289,1615-5297,SPRINGER HEIDELBERG
80,ACM TRANSACTIONS ON SOFTWARE ENGINEERING AND METHODOLOGY,1049-331X,1557-7392,ASSOC COMPUTING MACHINERY
81,ACM JOURNAL ON COMPUTING AND CULTURAL HERITAGE,1556-4673,1556-4711,ASSOC COMPUTING MACHINERY
82,REAL-TIME SYSTEMS,0922-6443,1573-1383,SPRINGER
83,EVOLVING SYSTEMS,1868-6478,1868-6486,SPRINGER HEIDELBERG
84,IET COMPUTERS AND DIGITAL TECHNIQUES,1751-8601,1751-861X,WILEY-HINDAWI
85,NEURAL COMPUTING & APPLICATIONS,0941-0643,1433-3058,SPRINGER LONDON LTD
86,APPLICABLE ALGEBRA IN ENGINEERING COMMUNICATION AND COMPUTING,0938-1279,1432-0622,SPRINGER
87,ACM TRANSACTIONS ON THE WEB,1559-1131,1559-114X,ASSOC COMPUTING MACHINERY
88,ACM TRANSACTIONS ON AUTONOMOUS AND ADAPTIVE SYSTEMS,1556-4665,1556-4703,ASSOC COMPUTING MACHINERY
89,ACM TRANSACTIONS ON MULTIMEDIA COMPUTING COMMUNICATIONS AND APPLICATIONS,1551-6857,1551-6865,ASSOC COMPUTING MACHINERY
90,PHOTONIC NETWORK COMMUNICATIONS,1387-974X,1572-8188,SPRINGER
91,ANNALS OF MATHEMATICS AND ARTIFICIAL INTELLIGENCE,1012-2443,1573-7470,SPRINGER
92,SIMULATION MODELLING PRACTICE AND THEORY,1569-190X,1878-1462,ELSEVIER
93,IEEE TRANSACTIONS ON COMPUTATIONAL SOCIAL SYSTEMS,2329-924X,2329-924X,IEEE-INST ELECTRICAL ELECTRONICS ENGINEERS INC
94,MULTIMEDIA TOOLS AND APPLICATIONS,1380-7501,1573-7721,SPRINGER
95,INTERNATIONAL JOURNAL OF MULTIMEDIA INFORMATION RETRIEVAL,2192-6611,2192-662X,SPRINGER
96,COMPUTER METHODS AND PROGRAMS IN BIOMEDICINE,0169-2607,1872-7565,ELSEVIER IRELAND LTD
97,PERFORMANCE EVALUATION,0166-5316,1872-745X,ELSEVIER
98,INTEGRATION-THE VLSI JOURNAL,0167-9260,1872-7522,ELSEVIER
99,BIG DATA RESEARCH,2214-5796,2214-5796,ELSEVIER
100,STATISTICS AND COMPUTING,0960-3174,1573-1375,SPRINGER
101,IEEE TRANSACTIONS ON VERY LARGE SCALE INTEGRATION (VLSI) SYSTEMS,1063-8210,1557-9999,IEEE-INST ELECTRICAL ELECTRONICS ENGINEERS INC
102,IEEE COMPUTATIONAL INTELLIGENCE MAGAZINE,1556-603X,1556-6048,IEEE-INST ELECTRICAL ELECTRONICS ENGINEERS INC
103,IEEE TRANSACTIONS ON PATTERN ANALYSIS AND MACHINE INTELLIGENCE,0162-8828,1939-3539,IEEE COMPUTER SOC
104,INTERNATIONAL JOURNAL OF MACHINE LEARNING AND CYBERNETICS,1868-8071,1868-808X,SPRINGER HEIDELBERG
105,LANGUAGE RESOURCES AND EVALUATION,1574-020X,1574-0218,SPRINGER
106,NATURAL COMPUTING,1567-7818,1572-9796,SPRINGER
107,DISPLAYS,0141-9382,1872-7387,ELSEVIER
108,MATHEMATICAL PROGRAMMING COMPUTATION,1867-2949,1867-2957,SPRINGER HEIDELBERG
109,WIRELESS NETWORKS,1022-0038,1572-8196,SPRINGER
110,JOURNAL OF MATHEMATICAL IMAGING AND VISION,0924-9907,1573-7683,SPRINGER
111,JOURNAL OF AUTOMATED REASONING,0168-7433,1573-0670,SPRINGER
112,IEEE TRANSACTIONS ON MULTIMEDIA,1520-9210,1941-0077,IEEE-INST ELECTRICAL ELECTRONICS ENGINEERS INC
113,OPTICAL SWITCHING AND NETWORKING,1573-4277,1872-9770,ELSEVIER
114,MEDICAL IMAGE ANALYSIS,1361-8415,1361-8423,ELSEVIER
115,IEEE TRANSACTIONS ON INFORMATION FORENSICS AND SECURITY,1556-6013,1556-6021,IEEE-INST ELECTRICAL ELECTRONICS ENGINEERS INC
116,MULTIDIMENSIONAL SYSTEMS AND SIGNAL PROCESSING,0923-6082,1573-0824,SPRINGER
117,JOURNAL OF NETWORK AND SYSTEMS MANAGEMENT,1064-7570,1573-7705,SPRINGER
118,INTERNATIONAL JOURNAL OF INTELLIGENT SYSTEMS,0884-8173,1098-111X,WILEY-HINDAWI
119,ADVANCED ENGINEERING INFORMATICS,1474-0346,1873-5320,ELSEVIER SCI LTD
120,IEEE CONSUMER ELECTRONICS MAGAZINE,2162-2248,2162-2256,IEEE-INST ELECTRICAL ELECTRONICS ENGINEERS INC
121,JOURNAL OF INTELLIGENT & ROBOTIC SYSTEMS,0921-0296,1573-0409,SPRINGER
122,SOFTWAREX,2352-7110,2352-7110,ELSEVIER
123,ACM TRANSACTIONS ON ARCHITECTURE AND CODE OPTIMIZATION,1544-3566,1544-3973,ASSOC COMPUTING MACHINERY
124,RANDOM STRUCTURES & ALGORITHMS,1042-9832,1098-2418,WILEY
125,SIGMOD RECORD,0163-5808,1943-5835,ASSOC COMPUTING MACHINERY
126,IEEE CANADIAN JOURNAL OF ELECTRICAL AND COMPUTER ENGINEERING,,2694-1783,IEEE CANADA
127,ARTIFICIAL INTELLIGENCE IN MEDICINE,0933-3657,1873-2860,ELSEVIER
128,ACM TRANSACTIONS ON INTERNET TECHNOLOGY,1533-5399,1557-6051,ASSOC COMPUTING MACHINERY
129,COGNITIVE SYSTEMS RESEARCH,2214-4366,1389-0417,ELSEVIER
130,ARCHIVES OF COMPUTATIONAL METHODS IN ENGINEERING,1134-3060,1886-1784,SPRINGER
131,PROCEEDINGS OF THE VLDB ENDOWMENT,2150-8097,2150-8097,ASSOC COMPUTING MACHINERY
132,INFORMATION PROCESSING LETTERS,0020-0190,1872-6119,ELSEVIER
133,VIRTUAL REALITY,1359-4338,1434-9957,SPRINGER LONDON LTD
134,CLUSTER COMPUTING-THE JOURNAL OF NETWORKS SOFTWARE TOOLS AND APPLICATIONS,1386-7857,1573-7543,SPRINGER
135,COMPUTER NETWORKS,1389-1286,1872-7069,ELSEVIER
136,INFORMATION SYSTEMS FRONTIERS,1387-3326,1572-9419,SPRINGER
137,INTERNATIONAL JOURNAL OF PARALLEL PROGRAMMING,0885-7458,1573-7640,SPRINGER/PLENUM PUBLISHERS
138,IEEE PERVASIVE COMPUTING,1536-1268,1558-2590,IEEE COMPUTER SOC
139,JOURNAL OF LOGIC LANGUAGE AND INFORMATION,0925-8531,1572-9583,SPRINGER
140,IEEE TRANSACTIONS ON SERVICES COMPUTING,1939-1374,1939-1374,IEEE COMPUTER SOC
141,JOURNAL OF REAL-TIME IMAGE PROCESSING,1861-8200,1861-8219,SPRINGER HEIDELBERG
142,JOURNAL OF GRID COMPUTING,1570-7873,1572-9184,SPRINGER
143,JOURNAL OF CLOUD COMPUTING-ADVANCES SYSTEMS AND APPLICATIONS,,2192-113X,SPRINGER
144,IEEE TRANSACTIONS ON CLOUD COMPUTING,2168-7161,2168-7161,IEEE-INST ELECTRICAL ELECTRONICS ENGINEERS INC
145,COMPUTER GRAPHICS FORUM,0167-7055,1467-8659,WILEY
146,INTERNET OF THINGS,2543-1536,2542-6605,ELSEVIER
147,COMPUTATIONAL COMPLEXITY,1016-3328,1420-8954,SPRINGER BASEL AG
148,THEORY OF COMPUTING SYSTEMS,1432-4350,1433-0490,SPRINGER
149,JOURNAL OF SIGNAL PROCESSING SYSTEMS FOR SIGNAL IMAGE AND VIDEO TECHNOLOGY,1939-8018,1939-8115,SPRINGER
150,IEEE MICRO,0272-1732,1937-4143,IEEE COMPUTER SOC
151,ACM TRANSACTIONS ON GRAPHICS,0730-0301,1557-7368,ASSOC COMPUTING MACHINERY
152,DESIGNS CODES AND CRYPTOGRAPHY,0925-1022,1573-7586,SPRINGER
153,IEEE TRANSACTIONS ON EVOLUTIONARY COMPUTATION,1089-778X,1941-0026,IEEE-INST ELECTRICAL ELECTRONICS ENGINEERS INC
154,JOURNAL OF SYSTEMS AND SOFTWARE,0164-1212,1873-1228,ELSEVIER SCIENCE INC
155,IEEE TRANSACTIONS ON COGNITIVE AND DEVELOPMENTAL SYSTEMS,2379-8920,2379-8939,IEEE-INST ELECTRICAL ELECTRONICS ENGINEERS INC
156,INTERNATIONAL JOURNAL OF RF AND MICROWAVE COMPUTER-AIDED ENGINEERING,1096-4290,1099-047X,WILEY
157,ENVIRONMENTAL MODELLING & SOFTWARE,1364-8152,1873-6726,ELSEVIER SCI LTD
158,IET IMAGE PROCESSING,1751-9659,1751-9667,WILEY
159,SOFTWARE QUALITY JOURNAL,0963-9314,1573-1367,SPRINGER
160,IEEE TRANSACTIONS ON PARALLEL AND DISTRIBUTED SYSTEMS,1045-9219,1558-2183,IEEE COMPUTER SOC
161,IEEE TRANSACTIONS ON RELIABILITY,0018-9529,1558-1721,IEEE-INST ELECTRICAL ELECTRONICS ENGINEERS INC
162,NEW GENERATION COMPUTING,0288-3635,1882-7055,SPRINGER
163,IEEE TRANSACTIONS ON GAMES,2475-1502,2475-1510,IEEE-INST ELECTRICAL ELECTRONICS ENGINEERS INC
164,IEEE TRANSACTIONS ON KNOWLEDGE AND DATA ENGINEERING,1041-4347,1558-2191,IEEE COMPUTER SOC
165,ENGINEERING WITH COMPUTERS,0177-0667,1435-5663,SPRINGER
166,JOURNAL OF CRYPTOGRAPHIC ENGINEERING,2190-8508,2190-8516,SPRINGER HEIDELBERG
167,IEEE SECURITY & PRIVACY,1540-7993,1558-4046,IEEE COMPUTER SOC
168,IEEE TRANSACTIONS ON EMERGING TOPICS IN COMPUTING,2168-6750,2168-6750,IEEE-INST ELECTRICAL ELECTRONICS ENGINEERS INC
169,VLDB JOURNAL,1066-8888,0949-877X,SPRINGER
170,DISTRIBUTED AND PARALLEL DATABASES,0926-8782,1573-7578,SPRINGER
171,COMPUTERS & SECURITY,0167-4048,1872-6208,ELSEVIER ADVANCED TECHNOLOGY
172,THEORETICAL COMPUTER SCIENCE,0304-3975,1879-2294,ELSEVIER
173,COMPUTER SUPPORTED COOPERATIVE WORK-THE JOURNAL OF COLLABORATIVE COMPUTING AND WORK PRACTICES,0925-9724,1573-7551,SPRINGER
174,COMPUTER SCIENCE REVIEW,1574-0137,1876-7745,ELSEVIER
175,INTERNATIONAL JOURNAL FOR NUMERICAL METHODS IN FLUIDS,0271-2091,1097-0363,WILEY
176,JOURNAL OF INDUSTRIAL INFORMATION INTEGRATION,2467-964X,2452-414X,ELSEVIER
177,FUTURE GENERATION COMPUTER SYSTEMS-THE INTERNATIONAL JOURNAL OF ESCIENCE,0167-739X,1872-7115,ELSEVIER
178,ACM TRANSACTIONS ON COMPUTATIONAL LOGIC,1529-3785,1557-945X,ASSOC COMPUTING MACHINERY
179,IEEE EMBEDDED SYSTEMS LETTERS,1943-0663,1943-0671,IEEE-INST ELECTRICAL ELECTRONICS ENGINEERS INC
180,IEEE TRANSACTIONS ON INTELLIGENT VEHICLES,2379-8858,2379-8904,IEEE-INST ELECTRICAL ELECTRONICS ENGINEERS INC
181,AUTOMATED SOFTWARE ENGINEERING,0928-8910,1573-7535,SPRINGER
182,IEEE NETWORK,0890-8044,1558-156X,IEEE-INST ELECTRICAL ELECTRONICS ENGINEERS INC
183,EARTH SCIENCE INFORMATICS,1865-0473,1865-0481,SPRINGER HEIDELBERG
184,IEEE INTELLIGENT SYSTEMS,1541-1672,1941-1294,IEEE COMPUTER SOC
185,IEEE TRANSACTIONS ON DEPENDABLE AND SECURE COMPUTING,1545-5971,1941-0018,IEEE COMPUTER SOC
186,IEEE TRANSACTIONS ON HAPTICS,1939-1412,2329-4051,IEEE COMPUTER SOC
187,ACM TRANSACTIONS ON RECONFIGURABLE TECHNOLOGY AND SYSTEMS,1936-7406,1936-7414,ASSOC COMPUTING MACHINERY
188,IEEE TRANSACTIONS ON LEARNING TECHNOLOGIES,1939-1382,1939-1382,IEEE COMPUTER SOC
189,ACM TRANSACTIONS ON DATABASE SYSTEMS,0362-5915,1557-4644,ASSOC COMPUTING MACHINERY
190,JOURNAL OF HEURISTICS,1381-1231,1572-9397,SPRINGER
191,IEEE TRANSACTIONS ON SOFTWARE ENGINEERING,0098-5589,1939-3520,IEEE COMPUTER SOC
192,JOURNAL OF INTELLIGENT INFORMATION SYSTEMS,0925-9902,1573-7675,SPRINGER
193,SOFTWARE TESTING VERIFICATION & RELIABILITY,0960-0833,1099-1689,WILEY
194,ACM TRANSACTIONS ON INFORMATION SYSTEMS,1046-8188,1558-2868,ASSOC COMPUTING MACHINERY
195,COMPUTERS AND GEOTECHNICS,0266-352X,1873-7633,ELSEVIER SCI LTD
196,MEDICAL & BIOLOGICAL ENGINEERING & COMPUTING,0140-0118,1741-0444,SPRINGER HEIDELBERG
197,IEEE TRANSACTIONS ON COMPUTER-AIDED DESIGN OF INTEGRATED CIRCUITS AND SYSTEMS,0278-0070,1937-4151,IEEE-INST ELECTRICAL ELECTRONICS ENGINEERS INC
198,IET SOFTWARE,1751-8806,1751-8814,WILEY-HINDAWI
199,FORMAL ASPECTS OF COMPUTING,0934-5043,1433-299X,ASSOC COMPUTING MACHINERY
200,IET INFORMATION SECURITY,1751-8709,1751-8717,WILEY-HINDAWI
201,INTERNATIONAL JOURNAL OF APPROXIMATE REASONING,0888-613X,1873-4731,ELSEVIER SCIENCE INC
202,JOURNAL ON MULTIMODAL USER INTERFACES,1783-7677,1783-8738,SPRINGER
203,ARTIFICIAL INTELLIGENCE AND LAW,0924-8463,1572-8382,SPRINGER
204,FORENSIC SCIENCE INTERNATIONAL-DIGITAL INVESTIGATION,,2666-2817,ELSEVIER SCI LTD
205,ACM TRANSACTIONS ON INTELLIGENT SYSTEMS AND TECHNOLOGY,2157-6904,2157-6912,ASSOC COMPUTING MACHINERY
206,ARTIFICIAL INTELLIGENCE,0004-3702,1872-7921,ELSEVIER
207,COMPUTER PHYSICS COMMUNICATIONS,0010-4655,1879-2944,ELSEVIER
208,IEEE-ACM TRANSACTIONS ON NETWORKING,1063-6692,1558-2566,IEEE-INST ELECTRICAL ELECTRONICS ENGINEERS INC
209,ALGORITHMICA,0178-4617,1432-0541,SPRINGER
210,JOURNAL OF INFORMATION SECURITY AND APPLICATIONS,2214-2126,2214-2134,ELSEVIER
211,IEEE WIRELESS COMMUNICATIONS,1536-1284,1558-0687,IEEE-INST ELECTRICAL ELECTRONICS ENGINEERS INC
212,JOURNAL OF THE ASSOCIATION FOR INFORMATION SCIENCE AND TECHNOLOGY,2330-1635,2330-1643,WILEY
213,ACM TRANSACTIONS ON ASIAN AND LOW-RESOURCE LANGUAGE INFORMATION PROCESSING,2375-4699,2375-4702,ASSOC COMPUTING MACHINERY
214,COMPUTER COMMUNICATIONS,0140-3664,1873-703X,ELSEVIER
215,INFORMATION AND SOFTWARE TECHNOLOGY,0950-5849,1873-6025,ELSEVIER
216,ACM TRANSACTIONS ON SENSOR NETWORKS,1550-4859,1550-4867,ASSOC COMPUTING MACHINERY
217,IEEE SOFTWARE,0740-7459,1937-4194,IEEE COMPUTER SOC
218,COGNITIVE COMPUTATION,1866-9956,1866-9964,SPRINGER
219,ACM TRANSACTIONS ON INTERACTIVE INTELLIGENT SYSTEMS,2160-6455,2160-6463,ASSOC COMPUTING MACHINERY
220,KNOWLEDGE-BASED SYSTEMS,0950-7051,1872-7409,ELSEVIER
221,JOURNAL OF COMBINATORIAL OPTIMIZATION,1382-6905,1573-2886,SPRINGER
222,JOURNAL OF CRYPTOLOGY,0933-2790,1432-1378,SPRINGER
223,ICT EXPRESS,2405-9595,2405-9595,ELSEVIER
224,SOFTWARE-PRACTICE & EXPERIENCE,0038-0644,1097-024X,WILEY
225,IMAGE AND VISION COMPUTING,0262-8856,1872-8138,ELSEVIER
226,JOURNAL OF SOFTWARE-EVOLUTION AND PROCESS,2047-7473,2047-7481,WILEY
227,DESIGN AUTOMATION FOR EMBEDDED SYSTEMS,0929-5585,1572-8080,SPRINGER
228,PATTERN ANALYSIS AND APPLICATIONS,1433-7541,1433-755X,SPRINGER
229,MOBILE NETWORKS & APPLICATIONS,1383-469X,1572-8153,SPRINGER
230,COMPUTATIONAL GEOSCIENCES,1420-0597,1573-1499,SPRINGER
231,WILEY INTERDISCIPLINARY REVIEWS-DATA MINING AND KNOWLEDGE DISCOVERY,1942-4787,1942-4795,"WILEY PERIODICALS, INC"
232,SWARM AND EVOLUTIONARY COMPUTATION,2210-6502,2210-6510,ELSEVIER
233,COMPUTATIONAL INTELLIGENCE,0824-7935,1467-8640,WILEY
234,ACM JOURNAL ON EMERGING TECHNOLOGIES IN COMPUTING SYSTEMS,1550-4832,1550-4840,ASSOC COMPUTING MACHINERY
235,ACM TRANSACTIONS ON EMBEDDED COMPUTING SYSTEMS,1539-9087,1558-3465,ASSOC COMPUTING MACHINERY
236,MINDS AND MACHINES,0924-6495,1572-8641,SPRINGER
237,ACM TRANSACTIONS ON PROGRAMMING LANGUAGES AND SYSTEMS,0164-0925,1558-4593,ASSOC COMPUTING MACHINERY
238,IEEE SYSTEMS JOURNAL,1932-8184,1937-9234,IEEE-INST ELECTRICAL ELECTRONICS ENGINEERS INC
239,JOURNAL OF SYSTEMS ARCHITECTURE,1383-7621,1873-6165,ELSEVIER
240,SCIENTOMETRICS,0138-9130,1588-2861,SPRINGER
241,SWARM INTELLIGENCE,1935-3812,1935-3820,SPRINGER
242,ACM TRANSACTIONS ON MATHEMATICAL SOFTWARE,0098-3500,1557-7295,ASSOC COMPUTING MACHINERY
243,DISTRIBUTED COMPUTING,0178-2770,1432-0452,SPRINGER
244,IEEE TRANSACTIONS ON MOBILE COMPUTING,1536-1233,1558-0660,IEEE COMPUTER SOC
245,ANALOG INTEGRATED CIRCUITS AND SIGNAL PROCESSING,0925-1030,1573-1979,SPRINGER
246,VISUAL COMPUTER,0178-2789,1432-2315,SPRINGER
247,INTERNATIONAL JOURNAL OF CRITICAL INFRASTRUCTURE PROTECTION,1874-5482,2212-2087,ELSEVIER
248,COMPUTER,0018-9162,1558-0814,IEEE COMPUTER SOC
249,ACM TRANSACTIONS ON PRIVACY AND SECURITY,2471-2566,2471-2574,ASSOC COMPUTING MACHINERY
250,ACM TRANSACTIONS ON STORAGE,1553-3077,1553-3093,ASSOC COMPUTING MACHINERY
251,NEURAL PROCESSING LETTERS,1370-4621,1573-773X,SPRINGER
252,GENETIC PROGRAMMING AND EVOLVABLE MACHINES,1389-2576,1573-7632,SPRINGER
253,IEEE MULTIMEDIA,1070-986X,1941-0166,IEEE COMPUTER SOC
254,SUSTAINABLE COMPUTING-INFORMATICS & SYSTEMS,2210-5379,2210-5387,ELSEVIER
255,INTERNATIONAL JOURNAL ON DOCUMENT ANALYSIS AND RECOGNITION,1433-2833,1433-2825,SPRINGER HEIDELBERG
256,FOUNDATIONS OF COMPUTATIONAL MATHEMATICS,1615-3375,1615-3383,SPRINGER
257,KNOWLEDGE AND INFORMATION SYSTEMS,0219-1377,0219-3116,SPRINGER LONDON LTD
258,IEEE DESIGN & TEST,2168-2356,2168-2364,IEEE-INST ELECTRICAL ELECTRONICS ENGINEERS INC
259,COMPUTER ANIMATION AND VIRTUAL WORLDS,1546-4261,1546-427X,WILEY
260,JOURNAL OF INFORMETRICS,1751-1577,1875-5879,ELSEVIER
261,IEEE TRANSACTIONS ON NETWORK AND SERVICE MANAGEMENT,1932-4537,1932-4537,IEEE-INST ELECTRICAL ELECTRONICS ENGINEERS INC
262,MULTIMEDIA SYSTEMS,0942-4962,1432-1882,SPRINGER
263,EMPIRICAL SOFTWARE ENGINEERING,1382-3256,1573-7616,SPRINGER
264,INTERNATIONAL JOURNAL OF COMPUTER VISION,0920-5691,1573-1405,SPRINGER
265,WORLD WIDE WEB-INTERNET AND WEB INFORMATION SYSTEMS,1386-145X,1573-1413,SPRINGER
266,COMPUTER-AIDED DESIGN,0010-4485,1879-2685,ELSEVIER SCI LTD
267,COMMUNICATIONS OF THE ACM,0001-0782,1557-7317,ASSOC COMPUTING MACHINERY
268,QUEUEING SYSTEMS,0257-0130,1572-9443,SPRINGER
269,PATTERN RECOGNITION,0031-3203,1873-5142,ELSEVIER SCI LTD
270,IEEE COMMUNICATIONS SURVEYS AND TUTORIALS,,1553-877X,IEEE-INST ELECTRICAL ELECTRONICS ENGINEERS INC
271,INFORMATION & MANAGEMENT,0378-7206,1872-7530,ELSEVIER
272,JOURNAL OF WEB SEMANTICS,1570-8268,1873-7749,ELSEVIER
273,INTERNATIONAL JOURNAL OF MEDICAL INFORMATICS,1386-5056,1872-8243,ELSEVIER IRELAND LTD
274,IEEE TRANSACTIONS ON NEURAL NETWORKS AND LEARNING SYSTEMS,2162-237X,2162-2388,IEEE-INST ELECTRICAL ELECTRONICS ENGINEERS INC
275,DECISION SUPPORT SYSTEMS,0167-9236,1873-5797,ELSEVIER
276,IEEE TRANSACTIONS ON BIG DATA,2332-7790,2332-7790,IEEE-INST ELECTRICAL ELECTRONICS ENGINEERS INC
277,IET BIOMETRICS,2047-4938,2047-4946,WILEY-HINDAWI
278,AD HOC NETWORKS,1570-8705,1570-8713,ELSEVIER
279,IEEE TRANSACTIONS ON MEDICAL IMAGING,0278-0062,1558-254X,IEEE-INST ELECTRICAL ELECTRONICS ENGINEERS INC
280,COMPUTER AIDED GEOMETRIC DESIGN,0167-8396,1879-2332,ELSEVIER
281,IEEE WIRELESS COMMUNICATIONS LETTERS,2162-2337,2162-2345,IEEE-INST ELECTRICAL ELECTRONICS ENGINEERS INC
282,MICROPROCESSORS AND MICROSYSTEMS,0141-9331,1872-9436,ELSEVIER
283,NEUROCOMPUTING,0925-2312,1872-8286,ELSEVIER
284,USER MODELING AND USER-ADAPTED INTERACTION,0924-1868,1573-1391,SPRINGER
285,DATA MINING AND KNOWLEDGE DISCOVERY,1384-5810,1573-756X,SPRINGER
286,MACHINE LEARNING,0885-6125,1573-0565,SPRINGER
287,CONSTRAINTS,1383-7133,1572-9354,SPRINGER
288,COMPUTATIONAL STATISTICS & DATA ANALYSIS,0167-9473,1872-7352,ELSEVIER
289,COMPLEX & INTELLIGENT SYSTEMS,2199-4536,2198-6053,SPRINGER HEIDELBERG
290,ACM COMPUTING SURVEYS,0360-0300,1557-7341,ASSOC COMPUTING MACHINERY
291,AUTONOMOUS ROBOTS,0929-5593,1573-7527,SPRINGER
292,INFORMATION FUSION,1566-2535,1872-6305,ELSEVIER
293,PATTERN RECOGNITION LETTERS,0167-8655,1872-7344,ELSEVIER
294,IEEE COMPUTER ARCHITECTURE LETTERS,1556-6056,1556-6064,IEEE COMPUTER SOC
